"co_ocupacao","ds_ocupacao","co_cbo","tp_escolaridade","st_restricao_idade"
1895,"COSTUREIRA DE REPARACAO DE ROUPAS","763015","4","16"
1896,"COSTUREIRO DE ROUPA DE COURO E PELE","763020","4","16"
1897,"AUXILIAR DE CORTE (PREPARACAO DA CONFECCAO DE ROUPAS)","763105","4","16"
1899,"ENFESTADOR DE ROUPAS","763115","3","16"
1900,"RISCADOR DE ROUPAS","763120","3","16"
1902,"COSTUREIRO NA CONFECCAO EM SERIE","763210","3","16"
1903,"COSTUREIRO,A MAQUINA NA CONFECCAO EM SERIE","763215","3","16"
1904,"ARREMATADEIRA","763305","3","16"
1905,"BORDADOR,A MAQUINA","763310","3","16"
1906,"MARCADOR DE PECAS CONFECCIONADAS PARA BORDAR","763315","3","16"
1907,"OPERADOR DE MAQUINA DE COSTURA DE ACABAMENTO","763320","3","16"
1908,"PASSADEIRA DE PECAS CONFECCIONADAS","763325","3","10"
1909,"TRABALHADOR POLIVALENTE DA CONFECCAO DE CALCADOS","764005","3","10"
1910,"CORTADOR DE CALCADOS,A MAQUINA (EXCETO SOLAS E PALMILHAS)","764105","3","10"
1911,"CORTADOR DE SOLAS E PALMILHAS,A MAQUINA","764110","3","10"
1912,"PREPARADOR DE CALCADOS","764115","3","10"
1913,"PREPARADOR DE SOLAS E PALMILHAS","764120","3","10"
1914,"COSTURADOR DE CALCADOS,A MAQUINA","764205","3","10"
1915,"MONTADOR DE CALCADOS","764210","3","10"
1916,"ACABADOR DE CALCADOS","764305","3","10"
1917,"CONFECCIONADOR DE ARTEFATOS DE COURO (EXCETO SAPATOS)","765005","3","10"
1918,"CHAPELEIRO DE SENHORAS","765010","3","10"
1919,"BONELEIRO","765015","3","10"
1920,"CORTADOR DE ARTEFATOS DE COURO (EXCETO ROUPAS E CALCADOS)","765105","3","10"
1921,"CORTADOR DE TAPECARIA","765110","3","10"
1922,"COLCHOEIRO (CONFECCAO DE COLCHOES)","765205","3","10"
1923,"CONFECCIONADOR DE BRINQUEDOS DE PANO","765215","3","10"
1924,"CONFECCIONADOR DE VELAS NAUTICAS,BARRACAS E TOLDOS","765225","3","10"
1925,"ESTOFADOR DE AVIOES","765230","3","10"
1926,"ESTOFADOR DE MOVEIS","765235","3","10"
1928,"MONTADOR DE ARTEFATOS DE COURO (EXCETO ROUPAS E CALCADOS)","765315","3","10"
1929,"TRABALHADOR DO ACABAMENTO DE ARTEFATOS DE TECIDOS E COUROS","765405","3","10"
1930,"COPIADOR DE CHAPA","766105","4","16"
1931,"GRAVADOR DE MATRIZ PARA FLEXOGRAFIA (CLICHERISTA)","766115","4","16"
1932,"EDITOR DE TEXTO E IMAGEM","766120","4","16"
1933,"MONTADOR DE FOTOLITO (ANALOGICO E DIGITAL)","766125","4","16"
1934,"GRAVADOR DE MATRIZ PARA ROTOGRAVURA (ELETROMECANICO E QUIMICO)","766130","4","16"
1935,"GRAVADOR DE MATRIZ CALCOGRAFICA","766135","4","16"
1936,"GRAVADOR DE MATRIZ SERIGRAFICA","766140","4","16"
1937,"OPERADOR DE SISTEMAS DE PROVA (ANALOGICO E DIGITAL)","766145","4","16"
1938,"OPERADOR DE PROCESSO DE TRATAMENTO DE IMAGEM","766150","4","16"
1939,"PROGRAMADOR VISUAL GRAFICO","766155","4","16"
1940,"IMPRESSOR (SERIGRAFIA)","766205","4","16"
1941,"IMPRESSOR CALCOGRAFICO","766210","4","16"
1942,"IMPRESSOR DE OFSETE (PLANO E ROTATIVO)","766215","4","16"
1943,"IMPRESSOR DE ROTATIVA","766220","4","16"
1944,"IMPRESSOR DE ROTOGRAVURA","766225","4","16"
1945,"IMPRESSOR DIGITAL","766230","4","16"
1946,"IMPRESSOR FLEXOGRAFICO","766235","4","16"
1947,"IMPRESSOR LETTERSET","766240","4","16"
1948,"IMPRESSOR TAMPOGRAFICO","766245","4","16"
1949,"IMPRESSOR TIPOGRAFICO","766250","4","16"
1950,"ACABADOR DE EMBALAGENS (FLEXIVEIS E CARTOTECNICAS)","766305","3","10"
1951,"IMPRESSOR DE CORTE E VINCO","766310","3","10"
1952,"OPERADOR DE ACABAMENTO (INDUSTRIA GRAFICA)","766315","3","10"
1953,"OPERADOR DE GUILHOTINA (CORTE DE PAPEL)","766320","3","10"
1954,"PREPARADOR DE MATRIZES DE CORTE E VINCO","766325","3","10"
1955,"LABORATORISTA FOTOGRAFICO","766405","4","16"
1956,"REVELADOR DE FILMES FOTOGRAFICOS,EM PRETO E BRANCO","766410","4","16"
1957,"REVELADOR DE FILMES FOTOGRAFICOS,EM CORES","766415","4","16"
1959,"TECELAO (TEAR MANUAL)","768105","2","10"
1960,"TECELAO DE TAPETES,A MAO","768110","2","10"
1961,"TRICOTEIRO,A MAO","768115","2","10"
1962,"REDEIRO","768120","2","10"
1826,"OPERADOR POLIVALENTE DA INDUSTRIA TEXTIL","761005","3","10"
1964,"CROCHETEIRO,A MAO","768130","2","10"
1965,"BORDADOR,A MAO","768205","2","10"
1966,"CERZIDOR","768210","1","10"
1967,"ARTIFICE DO COURO","768305","1","10"
1968,"CORTADOR DE CALCADOS,A MAO (EXCETO SOLAS)","768310","2","10"
1969,"COSTURADOR DE ARTEFATOS DE COURO,A MAO (EXCETO ROUPAS E CALCADOS)","768315","2","10"
1970,"SAPATEIRO (CALCADOS SOB MEDIDA)","768320","2","10"
1971,"SELEIRO","768325","2","10"
1972,"TIPOGRAFO","768605","3","10"
1973,"LINOTIPISTA","768610","3","10"
1974,"MONOTIPISTA","768615","3","10"
1975,"PAGINADOR","768620","3","10"
1976,"PINTOR DE LETREIROS","768625","3","10"
1977,"CONFECCIONADOR DE CARIMBOS DE BORRACHA","768630","3","10"
1978,"GRAVADOR,A MAO (ENCADERNACAO)","768705","3","10"
1979,"RESTAURADOR DE LIVROS","768710","3","10"
1980,"MESTRE (INDUSTRIA DE MADEIRA E MOBILIARIO)","770105","3","10"
1981,"MESTRE CARPINTEIRO","770110","3","10"
1982,"MARCENEIRO","771105","3","10"
1983,"MODELADOR DE MADEIRA","771110","3","10"
1984,"MAQUETISTA NA MARCENARIA","771115","3","10"
1985,"TANOEIRO","771120","3","10"
1986,"CLASSIFICADOR DE MADEIRA","772105","3","10"
1987,"IMPREGNADOR DE MADEIRA","772110","3","10"
1988,"SECADOR DE MADEIRA","772115","3","10"
1990,"OPERADOR DE SERRAS NO DESDOBRAMENTO DE MADEIRA","773110","3","16"
1991,"SERRADOR DE BORDAS NO DESDOBRAMENTO DE MADEIRA","773115","3","16"
1992,"SERRADOR DE MADEIRA","773120","3","16"
1993,"SERRADOR DE MADEIRA (SERRA CIRCULAR MULTIPLA)","773125","3","16"
1994,"SERRADOR DE MADEIRA (SERRA DE FITA MULTIPLA)","773130","3","16"
1995,"OPERADOR DE MAQUINA INTERCALADORA E PLACAS (COMPENSADOS)","773205","3","16"
1996,"PRENSISTA DE AGLOMERADOS","773210","3","16"
1998,"PREPARADOR DE AGLOMERANTES","773220","3","16"
1999,"OPERADOR DE DESEMPENADEIRA NA USINAGEM CONVENCIONAL DE MADEIRA","773305","3","16"
2000,"OPERADOR DE ENTALHADEIRA (USINAGEM DE MADEIRA)","773310","3","16"
2001,"OPERADOR DE FRESADORA (USINAGEM DE MADEIRA)","773315","3","16"
2002,"OPERADOR DE LIXADEIRA (USINAGEM DE MADEIRA)","773320","3","16"
2003,"OPERADOR DE MAQUINA DE USINAGEM MADEIRA,EM GERAL","773325","3","16"
2004,"OPERADOR DE MOLDURADORA (USINAGEM DE MADEIRA)","773330","3","16"
2005,"OPERADOR DE PLAINA DESENGROSSADEIRA","773335","3","16"
2006,"OPERADOR DE SERRAS (USINAGEM DE MADEIRA)","773340","3","16"
2008,"OPERADOR DE TUPIA (USINAGEM DE MADEIRA)","773350","3","16"
2009,"TORNEIRO NA USINAGEM CONVENCIONAL DE MADEIRA","773355","3","16"
2010,"OPERADOR DE MAQUINA BORDATRIZ","773405","3","16"
2011,"OPERADOR DE MAQUINA DE CORTINA DAGUA (PRODUCAO DE MOVEIS)","773410","3","16"
2012,"OPERADOR DE MAQUINA DE USINAGEM DE MADEIRA (PRODUCAO EM SERIE)","773415","3","16"
2013,"OPERADOR DE PRENSA DE ALTA FREQUENCIA NA USINAGEM DE MADEIRA","773420","3","16"
2014,"OPERADOR DE CENTRO DE USINAGEM DE MADEIRA (CNC)","773505","4","18"
2015,"OPERADOR DE MAQUINAS DE USINAR MADEIRA (CNC)","773510","4","18"
2016,"MONTADOR DE MOVEIS E ARTEFATOS DE MADEIRA","774105","3","10"
2017,"ENTALHADOR DE MADEIRA","775105","3","10"
2018,"FOLHEADOR DE MOVEIS DE MADEIRA","775110","3","10"
2019,"LUSTRADOR DE PECAS DE MADEIRA","775115","3","10"
2020,"MARCHETEIRO","775120","3","10"
2021,"CESTEIRO","776405","3","10"
2022,"CONFECCIONADOR DE ESCOVAS,PINCEIS E PRODUTOS SIMILARES (A MAO)","776410","3","10"
2023,"CONFECCIONADOR DE ESCOVAS,PINCEIS E PRODUTOS SIMILARES (A MAQUINA)","776415","3","10"
2024,"CONFECCIONADOR DE MOVEIS DE VIME,JUNCO E BAMBU","776420","3","10"
2025,"ESTEIREIRO","776425","3","10"
2026,"VASSOUREIRO","776430","3","10"
2027,"CARPINTEIRO NAVAL (CONSTRUCAO DE PEQUENAS EMBARCACOES)","777105","3","10"
2028,"CARPINTEIRO NAVAL (EMBARCACOES)","777110","3","10"
2029,"CARPINTEIRO NAVAL (ESTALEIROS)","777115","3","10"
2030,"CARPINTEIRO DE CARRETAS","777205","3","10"
2031,"CARPINTEIRO DE CARROCERIAS","777210","3","10"
2033,"CONDUTOR DE PROCESSOS ROBOTIZADOS DE PINTURA","781105","4","18"
2034,"CONDUTOR DE PROCESSOS ROBOTIZADOS DE SOLDAGEM","781110","4","18"
2035,"OPERADOR DE VEICULOS SUBAQUATICOS CONTROLADOS REMOTAMENTE","781305","4","18"
2036,"MERGULHADOR PROFISSIONAL (RASO E PROFUNDO)","781705","4","18"
2037,"OPERADOR DE DRAGA","782105","4","18"
2038,"OPERADOR DE GUINDASTE (FIXO)","782110","4","18"
2039,"OPERADOR DE GUINDASTE MOVEL","782115","4","18"
2040,"OPERADOR DE MAQUINA RODOFERROVIARIA","782120","4","18"
2041,"OPERADOR DE MONTA-CARGAS (CONSTRUCAO CIVIL)","782125","4","18"
2042,"OPERADOR DE PONTE ROLANTE","782130","4","18"
2043,"OPERADOR DE PORTICO ROLANTE","782135","4","18"
2044,"OPERADOR DE TALHA ELETRICA","782140","4","18"
2045,"SINALEIRO (PONTE-ROLANTE)","782145","4","18"
2046,"GUINCHEIRO (CONSTRUCAO CIVIL)","782205","3","10"
2047,"OPERADOR DE DOCAGEM","782210","3","10"
2048,"OPERADOR DE EMPILHADEIRA","782220","3","10"
2049,"MOTORISTA DE CARRO DE PASSEIO","782305","3","10"
2050,"MOTORISTA DE FURGAO OU VEICULO SIMILAR","782310","3","10"
2051,"MOTORISTA DE TAXI","782315","3","10"
2052,"MOTORISTA DE ONIBUS RODOVIARIO","782405","3","10"
2053,"MOTORISTA DE ONIBUS URBANO","782410","3","10"
2054,"MOTORISTA DE TROLEBUS","782415","4","18"
2056,"MOTORISTA DE CAMINHAO (ROTAS REGIONAIS E INTERNACIONAIS)","782510","4","18"
2057,"MOTORISTA OPERACIONAL DE GUINCHO","782515","4","18"
2058,"OPERADOR DE TREM DE METRO","782605","4","18"
2059,"MAQUINISTA DE TREM","782610","4","18"
2060,"MAQUINISTA DE TREM METROPOLITANO","782615","4","18"
2061,"MOTORNEIRO","782620","4","18"
2062,"AUXILIAR DE MAQUINISTA DE TREM","782625","4","18"
2063,"OPERADOR DE TELEFERICO (PASSAGEIROS)","782630","4","18"
2064,"MARINHEIRO DE CONVES (MARITIMO E FLUVIARIO)","782705","3","10"
2065,"MARINHEIRO DE MAQUINAS","782710","3","10"
2066,"MOCO DE CONVES (MARITIMO E FLUVIARIO)","782715","3","10"
2067,"MOCO DE MAQUINAS (MARITIMO E FLUVIARIO)","782720","3","10"
2068,"CONDUTOR DE VEICULOS DE TRACAO ANIMAL (RUAS E ESTRADAS)","782805","1","7"
2069,"TROPEIRO","782810","1","7"
2070,"BOIADEIRO","782815","1","7"
2071,"CONDUTOR DE VEICULOS A PEDAIS","782820","1","7"
2072,"AGENTE DE PATIO","783105","3","10"
2073,"MANOBRADOR","783110","3","10"
2074,"CARREGADOR (AERONAVES)","783205","1","14"
2075,"CARREGADOR (ARMAZEM)","783210","1","14"
2076,"CARREGADOR (VEICULOS DE TRANSPORTES TERRESTRES)","783215","1","14"
2077,"ESTIVADOR","783220","1","14"
2078,"AJUDANTE DE MOTORISTA","783225","1","14"
2079,"EMBALADOR,A MAO","784105","3","10"
2080,"EMBALADOR,A MAQUINA","784110","3","10"
2081,"OPERADOR DE MAQUINA DE ETIQUETAR","784115","3","10"
2083,"OPERADOR DE PRENSA DE ENFARDAMENTO","784125","3","10"
2084,"ALIMENTADOR DE LINHA DE PRODUCAO","784205","3","10"
2085,"MESTRE (INDUSTRIA PETROQUIMICA E CARBOQUIMICA)","810105","4","18"
2086,"MESTRE DE PRODUCAO QUIMICA","810110","4","18"
2087,"MESTRE (INDUSTRIA DE BORRACHA E PLASTICO)","810205","4","18"
2088,"MESTRE DE PRODUCAO FARMACEUTICA","810305","5","18"
2089,"OPERADOR DE PROCESSOS QUIMICOS E PETROQUIMICOS","811005","4","18"
2090,"OPERADOR DE SALA DE CONTROLE DE INSTALACOES QUIMICAS,PETROQUIMICAS E AFINS","811010","4","18"
2091,"MOLEIRO (TRATAMENTOS QUIMICOS E AFINS)","811105","3","10"
2093,"OPERADOR DE BRITADEIRA (TRATAMENTOS QUIMICOS E AFINS)","811115","3","18"
2094,"OPERADOR DE CONCENTRACAO","811120","3","18"
2095,"TRABALHADOR DA FABRICACAO DE RESINAS E VERNIZES","811125","3","18"
1963,"CHAPELEIRO (CHAPEUS DE PALHA)","768125","2","10"
2096,"TRABALHADOR DE FABRICACAO DE TINTAS","811130","3","18"
2098,"OPERADOR DE TRATAMENTO QUIMICO DE MATERIAIS RADIOATIVOS","811215","4","18"
2099,"OPERADOR DE CENTRIFUGADORA (TRATAMENTOS QUIMICOS E AFINS)","811305","4","18"
2100,"OPERADOR DE EXPLORACAO DE PETROLEO","811310","4","18"
2101,"OPERADOR DE FILTRO DE SECAGEM (MINERACAO)","811315","4","18"
2102,"OPERADOR DE FILTRO DE TAMBOR ROTATIVO (TRATAMENTOS QUIMICOS E AFINS)","811320","4","18"
2103,"OPERADOR DE FILTRO-ESTEIRA (MINERACAO)","811325","4","18"
2104,"OPERADOR DE FILTRO-PRENSA (TRATAMENTOS QUIMICOS E AFINS)","811330","4","18"
2105,"OPERADOR DE FILTROS DE PARAFINA (TRATAMENTOS QUIMICOS E AFINS)","811335","4","18"
2106,"DESTILADOR DE MADEIRA","811405","3","18"
2107,"DESTILADOR DE PRODUTOS QUIMICOS (EXCETO PETROLEO)","811410","3","18"
2109,"OPERADOR DE APARELHO DE REACAO E CONVERSAO (PRODUTOS QUIMICOS,EXCETO PETROLEO)","811420","3","18"
2110,"OPERADOR DE EQUIPAMENTO DE DESTILACAO DE ALCOOL","811425","3","18"
2111,"OPERADOR DE EVAPORADOR NA DESTILACAO","811430","3","18"
2112,"OPERADOR DE PAINEL DE CONTROLE (REFINACAO DE PETROLEO)","811505","4","18"
2113,"OPERADOR DE TRANSFERENCIA E ESTOCAGEM - NA REFINACAO DO PETROLEO","811510","4","18"
2114,"OPERADOR DE BRITADOR DE COQUE","811605","4","18"
2115,"OPERADOR DE CARRO DE APAGAMENTO E COQUE","811610","4","18"
2116,"OPERADOR DE DESTILACAO E SUBPRODUTOS DE COQUE","811615","4","18"
2117,"OPERADOR DE ENFORNAMENTO E DESENFORNAMENTO DE COQUE","811620","4","18"
2118,"OPERADOR DE EXAUSTOR (COQUERIA)","811625","4","18"
2119,"OPERADOR DE PAINEL DE CONTROLE","811630","4","18"
2120,"OPERADOR DE PRESERVACAO E CONTROLE TERMICO","811635","4","18"
2121,"OPERADOR DE REATOR DE COQUE DE PETROLEO","811640","4","18"
2122,"OPERADOR DE REFRIGERACAO (COQUERIA)","811645","4","18"
2123,"OPERADOR DE SISTEMA DE REVERSAO (COQUERIA)","811650","4","18"
2124,"BAMBURISTA","811705","3","10"
2125,"CALANDRISTA DE BORRACHA","811710","3","10"
2126,"CONFECCIONADOR DE PNEUMATICOS","811715","3","10"
2127,"CONFECCIONADOR DE VELAS POR IMERSAO","811725","3","10"
2128,"CONFECCIONADOR DE VELAS POR MOLDAGEM","811735","3","10"
2129,"LAMINADOR DE PLASTICO","811745","3","10"
2130,"MOLDADOR DE BORRACHA POR COMPRESSAO","811750","3","10"
2131,"MOLDADOR DE PLASTICO POR COMPRESSAO","811760","3","10"
2132,"MOLDADOR DE PLASTICO POR INJECAO","811770","3","10"
2133,"TREFILADOR DE BORRACHA","811775","3","10"
2134,"OPERADOR DE MAQUINA DE PRODUTOS FARMACEUTICOS","811805","4","18"
2135,"DRAGEADOR (MEDICAMENTOS)","811810","4","18"
2136,"OPERADOR DE MAQUINA DE FABRICACAO DE COSMETICOS","811815","4","18"
2138,"PIROTECNICO","812105","3","10"
2139,"TRABALHADOR DA FABRICACAO DE MUNICAO E EXPLOSIVOS","812110","3","10"
2140,"CILINDRISTA (PETROQUIMICA E AFINS)","813105","4","18"
2141,"OPERADOR DE CALANDRA (QUIMICA,PETROQUIMICA E AFINS)","813110","4","18"
2142,"OPERADOR DE EXTRUSORA (QUIMICA,PETROQUIMICA E AFINS)","813115","4","18"
2143,"OPERADOR DE PROCESSO (QUIMICA,PETROQUIMICA E AFINS)","813120","4","18"
2144,"OPERADOR DE PRODUCAO (QUIMICA,PETROQUIMICA E AFINS)","813125","4","18"
2145,"TECNICO DE OPERACAO (QUIMICA,PETROQUIMICA E AFINS)","813130","4","18"
2146,"ASSISTENTE DE LABORATORIO INDUSTRIAL","818105","4","18"
2147,"AUXILIAR DE LABORATORIO DE ANALISES FISICO-QUIMICAS","818110","4","18"
2148,"MESTRE DE SIDERURGIA","820105","4","18"
2149,"MESTRE DE ACIARIA","820110","4","18"
2150,"MESTRE DE ALTO-FORNO","820115","4","18"
2151,"MESTRE DE FORNO ELETRICO","820120","4","18"
2152,"MESTRE DE LAMINACAO","820125","4","18"
2153,"SUPERVISOR DE FABRICACAO DE PRODUTOS CERAMICOS,PORCELANATOS E AFINS","820205","4","18"
2154,"SUPERVISOR DE FABRICACAO DE PRODUTOS DE VIDRO","820210","4","18"
2155,"OPERADOR DE CENTRO DE CONTROLE","821105","4","18"
2156,"OPERADOR DE MAQUINA DE SINTERIZAR","821110","4","18"
2157,"FORNEIRO E OPERADOR (ALTO-FORNO)","821205","3","18"
2158,"FORNEIRO E OPERADOR (CONVERSOR A OXIGENIO)","821210","3","18"
2159,"FORNEIRO E OPERADOR (FORNO ELETRICO)","821215","3","18"
2160,"FORNEIRO E OPERADOR (REFINO DE METAIS NAO-FERROSOS)","821220","3","18"
2161,"FORNEIRO E OPERADOR DE FORNO DE REDUCAO DIRETA","821225","3","18"
2162,"OPERADOR DE ACIARIA (BASCULAMENTO DE CONVERTEDOR)","821230","3","18"
2163,"OPERADOR DE ACIARIA (DESSULFURACAO DE GUSA)","821235","3","18"
2164,"OPERADOR DE ACIARIA (RECEBIMENTO DE GUSA)","821240","3","18"
2165,"OPERADOR DE AREA DE CORRIDA","821245","3","18"
2166,"OPERADOR DE DESGASEIFICACAO","821250","3","18"
2167,"SOPRADOR DE CONVERTEDOR","821255","3","18"
2168,"OPERADOR DE LAMINADOR","821305","3","18"
2169,"OPERADOR DE LAMINADOR DE BARRAS A FRIO","821310","3","18"
2170,"OPERADOR DE LAMINADOR DE BARRAS A QUENTE","821315","3","18"
2171,"OPERADOR DE LAMINADOR DE METAIS NAO-FERROSOS","821320","3","18"
2172,"OPERADOR DE LAMINADOR DE TUBOS","821325","3","18"
2173,"OPERADOR DE MONTAGEM DE CILINDROS E MANCAIS","821330","3","18"
2174,"RECUPERADOR DE GUIAS E CILINDROS","821335","3","18"
2175,"ENCARREGADO DE ACABAMENTO DE CHAPAS E METAIS (TEMPERA)","821405","4","18"
2176,"ESCARFADOR","821410","4","18"
2177,"MARCADOR DE PRODUTOS (SIDERURGICO E METALURGICO)","821415","4","18"
2178,"OPERADOR DE BOBINADEIRA DE TIRAS A QUENTE,NO ACABAMENTO DE CHAPAS E METAIS","821420","4","18"
2179,"OPERADOR DE CABINE DE LAMINACAO (FIO-MAQUINA)","821425","4","18"
2181,"OPERADOR DE JATO ABRASIVO","821435","4","18"
2183,"PREPARADOR DE SUCATA E APARAS","821445","4","18"
2184,"REBARBADOR DE METAL","821450","4","18"
2185,"FORNEIRO DE CUBILO","822105","3","10"
2186,"FORNEIRO DE FORNO-POCO","822110","3","10"
2187,"FORNEIRO DE FUNDICAO (FORNO DE REDUCAO)","822115","3","10"
2188,"FORNEIRO DE REAQUECIMENTO E TRATAMENTO TERMICO NA METALURGIA","822120","3","10"
2189,"FORNEIRO DE REVERBERO","822125","3","10"
2190,"PREPARADOR DE MASSA (FABRICACAO DE ABRASIVOS)","823105","3","10"
2191,"PREPARADOR DE MASSA (FABRICACAO DE VIDRO)","823110","3","10"
2192,"PREPARADOR DE MASSA DE ARGILA","823115","3","10"
2193,"PREPARADOR DE BARBOTINA","823120","3","10"
2194,"PREPARADOR DE ESMALTES (CERAMICA)","823125","3","10"
2195,"PREPARADOR DE ADITIVOS","823130","3","10"
2196,"OPERADOR DE ATOMIZADOR","823135","3","10"
2197,"EXTRUSOR DE FIOS OU FIBRAS DE VIDRO","823210","2","10"
2198,"FORNEIRO NA FUNDICAO DE VIDRO","823215","2","10"
2199,"FORNEIRO NO RECOZIMENTO DE VIDRO","823220","2","10"
2200,"MOLDADOR DE ABRASIVOS NA FABRICACAO DE CERAMICA,VIDRO E PORCELANA","823230","2","10"
2201,"OPERADOR DE BANHO METALICO DE VIDRO POR FLUTUACAO","823235","2","10"
2202,"OPERADOR DE MAQUINA DE SOPRAR VIDRO","823240","2","10"
2203,"OPERADOR DE MAQUINA EXTRUSORA DE VARETAS E TUBOS DE VIDRO","823245","2","10"
2204,"OPERADOR DE PRENSA DE MOLDAR VIDRO","823250","2","10"
2205,"TEMPERADOR DE VIDRO","823255","2","10"
2206,"TRABALHADOR NA FABRICACAO DE PRODUTOS ABRASIVOS","823265","2","10"
2207,"CLASSIFICADOR E EMPILHADOR DE TIJOLOS REFRATARIOS","823305","3","10"
2208,"FORNEIRO (MATERIAIS DE CONSTRUCAO)","823315","3","10"
2209,"TRABALHADOR DA ELABORACAO DE PRE-FABRICADOS (CIMENTO AMIANTO)","823320","3","10"
2210,"TRABALHADOR DA ELABORACAO DE PRE-FABRICADOS (CONCRETO ARMADO)","823325","3","10"
2211,"TRABALHADOR DA FABRICACAO DE PEDRAS ARTIFICIAIS","823330","3","10"
2212,"OLEIRO (FABRICACAO DE TELHAS)","828105","2","7"
2213,"OLEIRO (FABRICACAO DE TIJOLOS)","828110","2","7"
2097,"OPERADOR DE CALCINACAO (TRATAMENTO QUIMICO E AFINS)","811205","4","18"
2215,"CILINDREIRO NA PREPARACAO DE PASTA PARA FABRICACAO DE PAPEL","831105","4","18"
2216,"OPERADOR DE BRANQUEADOR DE PASTA PARA FABRICACAO DE PAPEL","831110","4","18"
2218,"OPERADOR DE LAVAGEM E DEPURACAO DE PASTA PARA FABRICACAO DE PAPEL","831120","4","18"
2219,"OPERADOR DE MAQUINA DE SECAR CELULOSE","831125","4","18"
2220,"CALANDRISTA DE PAPEL","832105","4","18"
2221,"OPERADOR DE CORTADEIRA DE PAPEL","832110","4","18"
2222,"OPERADOR DE MAQUINA DE FABRICAR PAPEL (FASE UMIDA)","832115","4","18"
2223,"OPERADOR DE MAQUINA DE FABRICAR PAPEL (FASE SECA)","832120","4","18"
2224,"OPERADOR DE MAQUINA DE FABRICAR PAPEL E PAPELAO","832125","4","18"
2225,"OPERADOR DE REBOBINADEIRA NA FABRICACAO DE PAPEL E PAPELAO","832135","4","18"
2226,"CARTONAGEIRO,A MAQUINA","833105","4","18"
2227,"CONFECCIONADOR DE BOLSAS,SACOS E SACOLAS E PAPEL,A MAQUINA","833110","4","18"
2228,"CONFECCIONADOR DE SACOS DE CELOFANE,A MAQUINA","833115","4","18"
2229,"OPERADOR DE MAQUINA DE CORTAR E DOBRAR PAPELAO","833120","4","18"
2230,"OPERADOR DE PRENSA DE EMBUTIR PAPELAO","833125","4","18"
2231,"CARTONAGEIRO,A MAO (CAIXAS DE PAPELAO)","833205","3","10"
2232,"SUPERVISOR DE PRODUCAO DA INDUSTRIA ALIMENTICIA","840105","4","18"
2233,"SUPERVISOR DA INDUSTRIA DE BEBIDAS","840110","4","18"
2234,"SUPERVISOR DA INDUSTRIA DE FUMO","840115","4","18"
2235,"CHEFE DE CONFEITARIA","840120","4","18"
2236,"MOLEIRO DE CEREAIS (EXCETO ARROZ)","841105","3","10"
2237,"MOLEIRO DE ESPECIARIAS","841110","3","10"
2238,"OPERADOR DE PROCESSO DE MOAGEM","841115","3","10"
2239,"MOEDOR DE SAL","841205","3","10"
2240,"REFINADOR DE SAL","841210","3","10"
2241,"OPERADOR DE CRISTALIZACAO NA REFINACAO DE ACUCAR","841305","1","16"
2243,"OPERADOR DE MOENDA NA FABRICACAO DE ACUCAR","841315","1","10"
2244,"OPERADOR DE TRATAMENTO DE CALDA NA REFINACAO DE ACUCAR","841320","1","10"
2245,"COZINHADOR (CONSERVACAO DE ALIMENTOS)","841408","2","10"
2246,"COZINHADOR DE CARNES","841416","2","10"
2247,"COZINHADOR DE FRUTAS E LEGUMES","841420","2","10"
2248,"COZINHADOR DE PESCADO","841428","2","10"
2249,"DESIDRATADOR DE ALIMENTOS","841432","3","10"
2250,"ESTERILIZADOR DE ALIMENTOS","841440","3","10"
2251,"HIDROGENADOR DE OLEOS E GORDURAS","841444","3","10"
2252,"LAGAREIRO","841448","3","10"
2253,"OPERADOR DE CAMARAS FRIAS","841456","3","10"
2254,"OPERADOR DE PREPARACAO DE GRAOS VEGETAIS (OLEOS E GORDURAS)","841460","3","10"
2255,"PRENSADOR DE FRUTAS (EXCETO OLEAGINOSAS)","841464","3","10"
2256,"PREPARADOR DE RACOES","841468","3","10"
2257,"REFINADOR DE OLEO E GORDURA","841472","3","10"
2258,"TRABALHADOR DE FABRICACAO DE MARGARINA","841476","3","10"
2259,"TRABALHADOR DE PREPARACAO DE PESCADOS (LIMPEZA)","841484","3","10"
2260,"TRABALHADOR DE TRATAMENTO DO LEITE E FABRICACAO DE LATICINIOS E AFINS","841505","3","10"
2261,"MISTURADOR DE CAFE","841605","3","10"
2262,"TORRADOR DE CAFE","841610","3","10"
2263,"MOEDOR DE CAFE","841615","3","10"
2264,"OPERADOR DE EXTRACAO DE CAFE SOLUVEL","841620","3","10"
2265,"TORRADOR DE CACAU","841625","3","10"
2266,"MISTURADOR DE CHA OU MATE","841630","3","10"
2267,"ALAMBIQUEIRO","841705","3","10"
2268,"FILTRADOR DE CERVEJA","841710","3","10"
2269,"FERMENTADOR","841715","3","10"
2270,"TRABALHADOR DE FABRICACAO DE VINHOS","841720","3","10"
2271,"MALTEIRO (GERMINACAO)","841725","3","10"
2272,"COZINHADOR DE MALTE","841730","3","10"
2274,"VINAGREIRO","841740","3","10"
2275,"XAROPEIRO","841745","3","10"
2276,"OPERADOR DE FORNO (FABRICACAO DE PAES,BISCOITOS E SIMILARES)","841805","4","18"
2278,"OPERADOR DE MAQUINAS DE FABRICACAO DE CHOCOLATES E ACHOCOLATADOS","841815","3","10"
2279,"PREPARADOR DE MELADO E ESSENCIA DE FUMO","842105","3","10"
2280,"PROCESSADOR DE FUMO","842110","3","10"
2281,"CLASSIFICADOR DE FUMO","842115","3","10"
2282,"AUXILIAR DE PROCESSAMENTO DE FUMO","842120","3","10"
2283,"PREPARADOR DE FUMO NA FABRICACAO DE CHARUTOS","842205","3","10"
2284,"OPERADOR DE MAQUINA DE FABRICAR CHARUTOS E CIGARRILHAS","842210","3","10"
2285,"CLASSIFICADOR DE CHARUTOS","842215","3","10"
2286,"CORTADOR DE CHARUTOS","842220","3","10"
2287,"CELOFANISTA NA FABRICACAO DE CHARUTOS","842225","3","10"
2288,"CHARUTEIRO A MAO","842230","3","10"
2289,"DEGUSTADOR DE CHARUTOS","842235","3","10"
2290,"OPERADOR DE MAQUINA DE FABRICAR CIGARROS","842305","3","10"
2291,"DEFUMADOR DE CARNES E PESCADOS","848105","3","10"
2292,"SALGADOR DE ALIMENTOS","848110","3","10"
2293,"SALSICHEIRO (FABRICACAO DE LINGUICA,SALSICHA E PRODUTOS SIMILARES)","848115","3","10"
2294,"PASTEURIZADOR","848205","2","10"
2295,"QUEIJEIRO NA FABRICACAO DE LATICINIO","848210","2","10"
2296,"MANTEIGUEIRO NA FABRICACAO DE LATICINIO","848215","2","10"
2297,"PADEIRO","848305","2","10"
2298,"CONFEITEIRO","848310","2","10"
2299,"MASSEIRO (MASSAS ALIMENTICIAS)","848315","2","10"
2300,"TRABALHADOR DE FABRICACAO DE SORVETE","848325","2","10"
2301,"DEGUSTADOR DE CAFE","848405","4","18"
2302,"DEGUSTADOR DE CHA","848410","4","18"
2303,"DEGUSTADOR DE DERIVADOS DE CACAU","848415","4","18"
2304,"DEGUSTADOR DE VINHOS OU LICORES","848420","4","18"
2305,"ABATEDOR","848505","2","7"
2306,"ACOUGUEIRO","848510","2","7"
2307,"DESOSSADOR","848515","2","7"
2308,"MAGAREFE","848520","2","7"
2309,"RETALHADOR DE CARNE","848525","2","7"
2310,"TRABALHADOR DO BENEFICIAMENTO DE FUMO","848605","2","7"
2311,"SUPERVISOR DE MANUTENCAO (ELETROMECANICA)","860105","4","18"
2313,"SUPERVISOR DE OPERACAO ELETRICA (GERACAO,TRANSMISSAO E DISTRIBUICAO DE ENERGIA ELETRICA)","860115","4","18"
2314,"OPERADOR DE CENTRAL HIDRELETRICA","861105","4","18"
2315,"OPERADOR DE QUADRO DE DISTRIBUICAO DE ENERGIA ELETRICA","861110","4","18"
2316,"OPERADOR DE CENTRAL TERMOELETRICA","861115","4","18"
2317,"OPERADOR DE REATOR NUCLEAR","861120","4","18"
2318,"OPERADOR DE SUBESTACAO","861205","4","18"
2319,"FOGUISTA (LOCOMOTIVAS A VAPOR)","862105","3","10"
2320,"MAQUINISTA DE EMBARCACOES","862110","3","10"
2321,"OPERADOR DE BATERIA DE GAS DE HULHA","862115","3","10"
2322,"OPERADOR DE CALDEIRA","862120","3","10"
2323,"OPERADOR DE COMPRESSOR DE AR","862130","3","10"
2324,"OPERADOR DE ESTACAO DE BOMBEAMENTO","862140","3","10"
2325,"OPERADOR DE MAQUINAS FIXAS,EM GERAL","862150","3","10"
2326,"OPERADOR DE UTILIDADE (PRODUCAO E DISTRIBUICAO DE VAPOR,GAS,OLEO,COMBUSTIVEL,ENERGIA,OXIGENIO)","862155","3","10"
2327,"OPERADOR DE ESTACAO DE CAPTACAO,TRATAMENTO E DISTRIBUICAO DE AGUA","862205","4","18"
2328,"OPERADOR DE ESTACAO DE TRATAMENTO DE AGUA E EFLUENTES","862305","4","18"
2329,"OPERADOR DE FORNO DE INCINERACAO NO TRATAMENTO DE AGUA,EFLUENTES E RESIDUOS INDUSTRIAIS","862310","4","18"
2330,"OPERADOR DE INSTALACAO DE EXTRACAO,PROCESSAMENTO,ENVASAMENTO E DISTRIBUICAO DE GASES","862405","4","18"
2331,"OPERADOR DE INSTALACAO DE REFRIGERACAO","862505","3","10"
2332,"OPERADOR DE REFRIGERACAO COM AMONIA","862510","3","10"
2333,"OPERADOR DE INSTALACAO DE AR-CONDICIONADO","862515","3","10"
2334,"ENCARREGADO DE MANUTENCAO MECANICA DE SISTEMAS OPERACIONAIS","910105","4","18"
2335,"SUPERVISOR DE MANUTENCAO DE APARELHOS TERMICOS,DE CLIMATIZACAO E DE REFRIGERACAO","910110","4","18"
2336,"SUPERVISOR DE MANUTENCAO DE BOMBAS,MOTORES,COMPRESSORES E EQUIPAMENTOS DE TRANSMISSAO","910115","4","18"
2214,"MESTRE (INDUSTRIA DE CELULOSE,PAPEL E PAPELAO)","830105","4","18"
2429,"NAO INFORMADO","XXX","",""
2430,"ESPECIALISTA DE POLITICAS PUBLICAS E GESTAO GOVERNAMENTAL","111505","",""
2431,"ANALISTA DE PLANEJAMENTO E ORCAMENTO - APO","111510","",""
2432,"ESPECIALISTA EM DESENVOLVIMENTO DE CIGARROS","142610","",""
2433,"OCEANOGRAFO","213440","",""
2435,"BIOMEDICO ","221205","",""
